id,employer_id,titile,description,requirement,benefit,min_salary,max_salary,recruit_num,position,min_yoe,max_yoe,deadline,created_at,updated_at
25,25,"Chuyên Viên Telesales /Tư Vấn Sản Phẩm Giáo Dục (Lương Cứng 7 - 11 Triệu, Thu Nhập 13 - 30 Triệu, 100% Sẵn Data Nóng)","Build, deploy, manage, operate, maintain and improve automation tools to support work;Prepare periodic and non-recurring reports;Support other employees/departments with requests for data extraction, statistics, and analysis;Conduct data-driven studies/surveys to make recommendations on operational plans;Research and make recommendations on technology application into operation to increase productivity, reduce workload, and optimize operational processes;Perform other duties as required by the direct manager. ","- ĐỘ TUỔI : Dưới 30 tuổi, tốt nghiệp Cao đẳng trở lên
- Trên 6 tháng kinh nghiệm Telesale/Tư vấn tuyển sinh (trong lĩnh vực như: Giáo dục, ngân hàng, bảo hiểm, sale dược, spa, tư vấn tài chính, chứng khoán, xuất nhập khẩu, Logistics ......) trong năm 2021-2022
- Tinh thần thái độ tốt, ngoan , chăm chỉ
- Tư duy nhanh nhẹn
- Đam mê kiếm tiền, mục tiêu phát triển sự nghiệp trong nghề Telesale/Tư vấn tuyển sinh.
- Sẵn sàng lăn xả để có mức thu nhập cao.- Ứng viên làm việc tại Hà Nội ","- Lương cứng theo năng lực (từ 7 -11 triệu + hoa hồng hấp dẫn 4 - 7%)
- Thu nhập cạnh tranh (từ 13 - 30 triệu/tháng)
- Đánh giá điều chỉnh tăng lương 3 tháng/lần, có cơ hội phát triển thăng tiến lên các vị trí cao
- Thử việc được hưởng 100% Lương cứng và hoa hồng
- Được cung cấp nguồn Data nóng có sẵn, tỷ lệ chốt cao.
- Ngoài ra còn có các mốc thưởng hấp dẫn đi kèm: thưởng nóng, thưởng Best sale, thưởng tăng tốc theo ngày, tuần, tháng, năm
- Được đào tạo thường xuyên từ các Chuyên gia tư vấn Tuyển sinh/Đào tạo hàng đầu thị trường.
- Được đại diện Công ty EDUPIA cung cấp sản phẩm chất lượng, uy tín có thương hiệu lớn hàng đầu Việt Nam
- Được tặng bộ sản phẩm học Tiếng Anh online trọn đời ngay khi nhận việc tại Edupia, giá trị tương đương 7.200.000 đồng.
PHÚC LỢI KHÁC:
- Thưởng tháng 13, ngày Lễ/ Tết
- Được tham gia đầy đủ BHXH theo quy định luật lao động
- Du lịch hàng năm với địa điểm hấp dẫn, thường xuyên tổ chức các hoạt động team building gắn kết cộng đồng, các hoạt động vui chơi giải trí cho nhân viên.
- Môi trường làm việc trẻ trung, năng động, văn phòng đẹp, tiện nghi, hiện đại, đề cao giá trị tập thể và tôn trọng sự phát triển của mỗi cá nhân. ",13,30,30,Toàn thời gian,0,1,4/19/2024,4/19/2024,4/3/2023
26,29,Thiết Kế UI/UX (8-12Tr),"Assisting the implementation of all stages of the training process and policy (from needs analysis, and planning to organization and evaluation of training effectiveness);Assisting in the development of training materials (slides, exams), as well as media image and video design;Tracking and management data related to learning activities;Supporting the operation of the E-learning system;Supporting other tasks when required. ","– Tốt nghiệp cao đẳng trở lên, chuyên ngành thiết kế– Có ít nhất 1 năm kinh nghiệm ở vị trí tương đương– Có khiếu thẩm mỹ khá, nhận diện và biết sắp xếp bố cục hợp lý.– Có kinh nghiệm đánh giá thông qua Portfolio về UI/UX ","- Mức lương cứng thỏa thuận: 10-12 triệu- Phụ cấp ăn trưa, gửi xe theo quy định.- Các chế độ Bảo hiểm xã hội, ngày nghỉ lễ tết phép thực hiện đầy đủ theo như luật lao động quy định- Tham gia các Câu lạc bộ dưới sự tài trợ chính thức của Công ty: CLB Bóng đá, các CLB Game, tham gia các bữa tiệc, hoạt động ngoại khóa của công ty ...- Tham gia các buổi Happy hour ăn nhẹ cùng nhân viên trong công ty hàng tuần.- Được tham gia các buổi đào tạo định hướng, đào tạo hội nhập do công ty thuê các chuyên gia về đào tạo hàng tuần cho nhân viên.- Thưởng cuối năm theo kết quả công việc của nhân viên và kết quả kinh doanh của công ty.- Tặng quà sinh nhật hiếu hỉ đầy đủ theo quy định của công ty.- Du lịch/nghỉ mát/teambuiding 2 -3 lần/năm (Nghỉ hè, thu, đông).- Thời gian làm việc: 8h15-17h30, Thứ 2- Thứ 6 và Thứ 7 cách tuần nghỉ chủ nhật. ",10,12,1,Toàn thời gian,0,0,3/28/2024,3/28/2024,4/3/2023
27,13,Cộng Tác Viên Chương Trình Giáo Dục Toán Tiếng Việt Tại Hà Nội ( Bán Thời Gian -Online) ,"Tìm kiếm, thuyết phục các doanh nghiệp chuyên về lĩnh vực vận tải để ký hợp đồng hợp tác cung cấp các loại hình xe cho Aha.Giữ connect, gặp mặt các đội nhóm tài xế xe tải, hỗ trợ chăm sóc, tư vấn trên các nhóm tuyển dụng tài xế.Trao đổi với các team, các phòng ban liên quan để duy trì quan hệ với các doanh nghiệp vận tải tại các khu vực Ahamove hoạt động để có thể ký hợp đồng khi cần.Phối hợp thực hiện các hoạt động tuyển dụng tài xế tại các khu vực. ","-Thiết kế bài tập, bài ôn tập, kiểm tra đánh giá theo chuyên đề-Sinh viên chuyên ngành sư phạm tiểu học, sư phạm toán, sư phạm văn, hoặc các chuyên ngành liên quan.-Có kinh nghiệm giảng dạy môn Toán và/hoặc Tiếng Việt chương trình tiểu học là một lợi thế-Đảm bảo hoàn thành công việc đúng thời hạn-Nhanh nhẹn, linh hoạt, sáng tạo tốt ","- Lương : 35k/giờ-Làm việc trong môi trường công bằng, chuyên nghiệp, minh bạch-Được học hỏi và phát triển chuyên môn-Có cơ hội nhận chính thức làm việc tạp tập đoàn lớn ",3,8,10,Bán thời gian,0,0,3/31/2023,5/13/2023,4/3/2023
28,36,Nhân Viên Kinh Doanh (Thu Nhập Từ 10 - 20 Triệu),"Hỗ trợ trong tất cả các hoạt động của quy trình tuyển dụng như: đăng công việc trên các trang web tuyển dụng, liên hệ với ứng viên, chào đón các ứng viên, sắp xếp các bài kiểm tra và lập lịch phỏng vấn, nhập dữ liệu, v.v.;Tham gia quá trình tuyển dụng cho các vị trí non-tech;Xây dựng cơ sở dữ liệu ứng viên;Tham gia vào các hoạt động xây dựng thương hiệu của nhà tuyển dụng với các trường đại học, cao đẳng & tổ chức giáo dục;Hỗ trợ thực hiện các chương trình, sự kiện nội bộ;Các yêu cầu hành chính khác từ quản lý trực tiếp. ","-	Tốt nghiệp Trung cấp trở lên các chuyên nghành kinh doanh, kế toán, nhân sự,….
-	Nhanh nhẹn, có khả năng thuyết phục, đàm phán,
-	Thành thạo tin học văn phòng cơ bản;
-	Yêu thích kinh doanh, nhiệt tình, độc lập
- Không yêu cầu kinh nghiệm, tuổi từ 20 đến 35 tuổi. ","- Được hưởng đầy đủ các chế độ theo quy định Bộ Luật Lao động và theo Quy định của Công ty: đóng BHXH 100% sau thử việc, thưởng lễ, tết, sinh nhật, hiếu, hỉ, nghỉ mát hàng năm theo quy định;
- Môi trường làm việc chuyên nghiệp, năng động, thân thiện;
- Thu nhập từ 10-20 triệu;
- Thời gian làm việc: 8h00 - 17h30 từ Thứ 2 -> sáng Thứ 7 hàng tuần, nghỉ trưa 1h30p;
- Nghỉ lễ - nghỉ Tết theo quy định của nhà nước, lương tháng 13. ",10,20,5,Toàn thời gian,0,0,3/30/2023,7/30/2023,4/3/2023
29,26,Chuyên Viên Kế Toán Thuế (10-15 Triệu),"Quản lý tài sản XE ĐIỆN:- Quản lý việc thẩm định hồ sơ tài xế thuê xe điện (giấy tờ thông tin cá nhân, nhà cửa - hộ khẩu, nhân thân gia đình)- Ký hợp đồng cho thuê và bàn giao xe cho tài xế thuê- Quản lý xe trong cửa hàng và trong kho của công ty- Kiểm tra và thu hồi xe khi tài xế không thuê nữaTuyển dụng, đào tạo mới tài xế chạy dịch vụ XE ĐIỆN:- Phối hợp với các phòng ban để đảm bảo số lượng tài xế tuyển dụng mới cho dịch vụ xe điện tại Đà Nẵng.- Phối hợp với nhân sự tại Đà Nẵng hướng dẫn đào tạo tài xế chạy dịch vụ XE ĐIỆN về quy trình- Chịu trách nhiệm và báo cáo trực tiếp vận hành theo tuần, tháng các chỉ số vận hành.Quản lý đội tài xế chạy XE ĐIỆN, Đảm bảo các chỉ số vận hành và chất lượng của dịch vụ XE ĐIỆN:- Theo dõi sát sao trong quá trình đội tài xế thực hiện quá trình giao hàng bằng xe điện- Tạo nhóm liên hệ và hỗ trợ tài xế trong quá trình chạy.- Thu thập ý kiến của tài xế về XE ĐIỆN trong quá trình chạy, đề xuất lại với trưởng bộ phận tối ưu quy trình và phương tiện- Theo dõi và kiểm tra tài xế sử dụng đúng mục đích xe cho quá trình giao hàng; kiểm tra chặt chẽ và nâng cao chất lượng phục vụ khách hàng;- Đảm bảo các chỉ số vận hành: tỉ lệ hoàn thành đơn, hủy chuyến, đúng giờ. Điều phối tài xế chạy đơn để đảm bảo hiệu quả vận hành ","- Tốt nghiệp Cao đẳng trở lên, chuyên ngành tài chính, kế toán hoặc các chuyên ngành có liên quan- Tối thiểu 2 năm kinh nghiệm vị trí kế toán.- Ưu tiên có kinh nghiệm làm lĩnh vực sản xuất- Có kỹ năng sử dụng tin học văn phòng (excel)- Cứng rắn, nguyên tắc, trung thực, cẩn thận ","- Dải lương: 10 - 15 triệu/tháng- Tham gia đầy đủ bảo hiểm và các chế độ khác theo Luật.- Được thưởng lợi nhuận vượt, lương tháng 13- Hỗ trợ ăn trưa, chi phí gửi xe- Được học tập các khóa học chuyên sâu và phát triển bản thân- Cơ hội thăng tiến lên vị trí cao hơn- Tham gia du lịch/teambuilding, year end party,…- Và nhiều chế độ hấp dẫn khác ",10,15,1,Toàn thời gian,2,2,3/31/2024,6/1/2024,4/3/2023
30,35,Thực Tập Sinh Tiềm Năng - Phòng Hỗ Trợ Tín Dụng / Trung Tâm Hỗ Trợ Và Xử Lý Tín Dụng Tập Trung Miền Bắc / Khối Vận Hành,"-Nhận data khách hàng và chuyển đổi trở thành khách hàng sử dụng thành công dịch vụ AhaMove- Tìm kiếm khách hàng mới qua các kênh phương tiện truyền thông (facebook, zalo, google, Shopee, Lazada.…)- Đảm bảo thời gian xử lý, hỗ trợ khách hàng theo SLA của công ty- Phân chia, quản lý tập khách hàng, tối đa hoá doanh thu- Quản lý chi phí khuyến mãi cho khách hàng trong ngân sách sẵn có- Lập kế hoạch kinh doanh & Báo cáo kết quả kinh doanh hằng tuần/ tháng / quý- Hỗ trợ đào tạo nhân viên mới ","Yêu cầu chung:Sinh viên Đại Học chính quy năm 2 trở lên các chuyên ngành Kinh tế, Tài chính, Ngân hàng hoặc các chuyên ngành tương tựCó tinh thần học hỏi và nhiệt huyết trong công việcKhả năng tư duy hệ thống, giao tiếp và làm việc nhómƯu tiên:- Sinh viên nhận các giải thưởng/sáng kiến được ghi nhận bởi các trường Đại học- Sinh viên ưu tú được các trường Đại học ghi nhận- Tham gia năng nổ các hoạt động đoàn thể, hoạt động ngoại khóa ","Được ưu tiên xét duyệt tuyển dụng các vị trí căn cứ trên đánh giá năng lực khi kết thúc quá trình TTS tại VPBankĐược hưởng thù lao, cơ chế khen thưởng cho TTS sau mỗi kỳ đánh giáĐược tham gia các khóa đào tạo bài bản, chuyên sâu bởi các chuyên gia trong lĩnh vực Tài chính – Ngân hàngCÁC VÒNG TUYỂN CHỌN:- Vòng 1: Sơ tuyển hồ sơ- Vòng 2: Kiểm tra năng lực thông qua bài Test- Vòng 3: Phỏng vấn- Vòng 4: Gia nhập VPBank ",1,2,1,Thực tập,0,0,1/3/2023,4/8/2023,4/3/2023
31,23,Kế Toán Tổng Hợp (Nam) Văn Phòng Bắc Từ Liêm,"Tiến hành giới thiệu việc làm đối tác tài xế tại Ahamove đến người lao động thông qua danh sách có sẵn, hỗ trợ người lao động trở thành Đối tác tài xế của Ahamove qua điện thoại và các kênh online khác;Phụ trách hỗ trợ xử lí hồ sơ tài xế trên hệ thống;Phối hợp với các bộ phận liên quan về việc truyền thông các chương trình/khảo sát đến đối tác giao hàng (nếu có);Báo cáo trực tiếp công việc daily, weekly cho quản lý trực tiếp. ","- Tốt nghiệp chuyên ngành kế toán, tài chính- Có từ 02 năm kinh nghiệm ở vị trí tương đương- Có kỹ năng tốt về tin học văn phòng.- Trung thực, chủ động, có trách nhiệm, có khả năng làm việc nhóm. ","+ Thu nhập từ 12.000.000 đ - 15.000.000 đ / tháng+ Thời gian làm việc : Từ thứ 2 đến hết sáng thứ 7+ Được thưởng tháng 13+ Thưởng hiệu quả kinh doanh cuối năm+ Thưởng theo thâm niên+ Hỗ trợ ăn trưa: 30k/ngày.+ Gửi xe miễn phí.+ Được tham gia BHXH.+ Hưởng 12 ngày phép/năm.+ Thưởng các ngày lễ, tết, sinh nhật (1/1, 30/4,1/5,1/6, 2/9, Trung thu, 8/3, 20/10)+ Được chế độ cho Tứ thân Phụ mẫu, cho vợ (chồng) và cho con.+ Được đào tạo nâng cao chuyên môn, nghiệp vụ.+ Du lịch hằng năm+ Được làm việc trong môi trường chuyên nghiệp, trẻ trung, năng động. ",12,15,2,Toàn thời gian,1,1,3/17/2023,8/21/2023,4/3/2023
32,32,Chuyên Viên Hành Chính Nhân Sự - Đà Nẵng,"About the Role    The Strategy & Planning (S&P) team shapes our strategic approach nationwide and coordinates actions across Operations, Platform, Enterprise, Customer Excellent, and other functional teams. The team is responsible for leading governance, the annual planning cycle, quarterly strategy refresh, and our competitive strategy and response.    Additionally, the team is uniquely positioned as an incubator for strategic bets which historically have involved launching key products and partnerships.What the Candidate Will Do    This role reports to the VP of Delivery. S/he will have high visibility with senior leadership and a seat at the table for critical meetings and decisions    S/he will be a key partner to the VP of Delivery as a facilitator, advisor, creator, and executor of corporate, operating, and competitive strategy. S/he will be at the nexus of information within internal business partners at a global, regional and local level. Key responsibilities will include:Strategy: Work closely with the leadership team to co-create, align and iterate on the overall vision & strategy for the Delivery department.Planning: Support annual and quarterly planning while working to build out operational reporting, objectives and key results, projections, and key business metrics to inform the leadership and the entire org of where the business stands.Competitive Analysis: Support full lifecycle of competitive data tracking and analysis for the region, from data vendor procurement and insights generation to understanding of regional and market-level competitor strategiesGovernance: Support nationwide governance, including monthly and quarterly business reviewsProgram / Project management: Support the growth of strategic bets that are being incubated or require strategic leadership and support across the countryLeadership stakeholder management: Foster strong working relationships with leaders from cross-functional teams (Marketing, Finance, HR, Engineering, Product, etc.) and help elevate Delivery department’s priorities on their agenda ","Nam/ Nữ, tuổi từ 24 – 30 tuổi (Ưu tiên nam)Tốt nghiệp chuyên ngành Quản trị Nguồn nhân lực, QTKD hoặc các ngành liên quanKỹ năng giao tiếp, trình bày tốt.Có khả năng thiết lập và duy trì mối quan hệ.Có kiến thức cơ bản về Quản trị nhân sự, Luật lao độngCó kinh nghiệm lĩnh vực Nhân sự từ 02 năm trở lên.Có kinh nghiệm tuyển dụng tỉnh thuộc các công ty kinh doanh bán lẻ, chuỗi cửa hàng là một lợi thế. ","Với phương châm “Con người là yếu tố cốt lõi của sự phát triển”, FPT Long Châu luôn tạo ra môi trường làm việc năng động, chuyên nghiệp và đầy thách thức; nơi tôn vinh những tài năng của mỗi cá nhân, tôn trọng từng cá tính khác biệt nhưng có cùng mục tiêu chung.THU NHẬP HẤP DẪNMức lương cạnh tranh và nhiều loại phụ cấp khác nhau cùng thưởng tháng lương 13 hoặc nhiều hơn tuỳ theo sự phát triển kinh doanh tăng trưởng hằng nămTăng lương, thưởng định kỳ theo thâm niênNhiều chương trình nội bộ kèm phần thưởng hiện kim xứng đángĐẦY ĐỦ QUYỀN LỢINhiều chương trình nội bộ ý nghĩa như đào tạo và thi đua nâng cao kĩ năng, hội thao FRT, ngày hội gia đình, chi thưởng ngày lễ, chúc mừng sinh nhật, team building, du lịch hằng năm, cuộc thi vẽ tranh và trao học bổng cho con em CBNV...Tham gia đầy đủ các chế độ: BHYT, BHXH, BHTN,...Hỗ trợ cho CBNV khi cha mẹ mất, thăm hỏi CBNV ốm đau, nằm việnChính sách hỗ trợ CBNV bị ảnh hưởng bởi Covid-19Khám sức khỏe định kỳ hàng năm.Các phúc lợi nghỉ lễ tết, hiếu hỷ, kết hôn, sinh con...PHÁT TRIỂN ĐI XAFPT Long Châu tự tin là nơi định hướng môi trường làm việc tốt nhất cho nhân viên, phát triển cùng sự vững mạnh của công tyCác chương trình đào tạo từ khi nhận việc, đào tạo chuyên môn nâng cao, đào tạo kĩ năng quản lýĐược đào tạo theo chính sách công ty, hỗ trợ các khoá đào tạo chuyên sâu - Coursera, Udemy,...Tham gia Quỹ cộng đồng vì người FRT thực hiện nhiều hoạt động ý nghĩa cho xã hội như ""Long Châu sẻ chia"", ""Quỹ Hy vọng"", xây trường cho trẻ mồ côi,... ",1,2,2,Toàn thời gian,1,2,3/31/2023,2/6/2024,4/3/2023
33,26,Nhân Viên Bán Hàng Store Đồ Công Nghệ,Acquire new customer-Search and contact the potential big merchants who need to use Ahamove's shipping services.Customer satisfaction and DevelopmentProactive and identify key prospective clients and find ways to associate with them in order to enhance the business:-Retain-Nurture-GrowthDevelopment Strategy:-Daily Incentive Game (promotion campaign for customers);-Find x-factors (potential customers);-Growth strategy in Holidays/Events;-Support new projects (innovation).Product Development:-Product development (improvement + add on service). ,"- Tuổi từ 20 - 30.- Tốt nghiệp trung cấp trở lên.- Ưu tiên đã có kinh nghiệm bán hàng tại Store.- Ngoại hình sáng ưa nhìn, giọng nói truyền cảm, dễ nghe.- Nam cao từ 1m70, nữ cao từ 1m60 trở lên.- Kỹ năng giao tiếp và ứng xử tốt.Phỏng vấn và Đào tạo tại Trụ sở Công ty TNHH Thương mại KATA Việt Nam – Tầng 3 G5 FiveStar, 02 Kim Giang, Thanh Xuân, Hà Nội. ","- Lương cứng 6tr + Bonus KPIs (Thu nhập trung bình 7 - 10tr/tháng)- Được đào tạo sản phẩm, kỹ năng giao tiếp, tư vấn, khai thác nhu cầu khách hàng, chuyên nghiệp và xét theo năng lực, có cơ hội trở thành quản lý cửa hàng.- Là nhân viên chính thức hưởng mọi chế độ phúc lợi của KATA.- Làm việc trong môi trường trẻ trung, năng động, linh hoạt.- Sở hữu sản phẩm công ty với giá ưu đãi.- Tham gia đóng BHXH, BHYT, BHTN theo quy định của pháp luật.- Các chế độ khác theo quy định của pháp luật. ",7,10,5,Bán thời gian,0,0,3/26/2024,1/9/2024,4/3/2023
34,4,Nhân Viên Kinh Doanh Phần Mềm,"• Quay và chỉnh sửa các video về cảm nhận của khách hàng khi sử dụng dịch vụ của nha khoa.• Quay và chỉnh sửa các video của phòng khám.• Phối hợp cùng team Content lên ý tưởng, kế hoạch quay quảng cáo.• Sắp xếp lịch quay video để hoàn thành KPI video theo tuần.• Quay phim, dựng phim, chụp hình phục vụ cho các hoạt động của công ty.• Quản lý kho hình ảnh, video.• Các công việc khác theo yêu cầu của cấp trên. ","Có kiến thức cơ bản về bán hàngCó kỹ năng giao tiếp, xử lý tình huống ổnCó tinh thần ham học hỏi, nhiệt tình, cầu tiến trong công việcYêu thích công nghệ và thích tìm hiểu các sản phẩm phần mềm là 1 lợi thếCó kinh nghiệm sale và telesale là 1 lợi thế (không bắt buộc) ","Thu nhập: lương cứng + commission theo doanh thuĐược đào tạo nếu chưa có nhiều kiến thức/kỹ năngCó cơ hội kết nối và học hỏi với nhiều mentor trong network của công ty (các lĩnh vực Marketing, Sales, Quản lý, Công nghệ,...)Được tạo điều kiện thuận lợi để phát huy tối đa khả năng của bản thânCơ hội phát triển và thăng tiến trong công việc (nhanh tuỳ năng lực)Tham gia team building cùng công tyThời gian làm việc linh hoạt part-time/full-time ",2,6,3,Bán thời gian,0,0,3/26/2023,12/18/2023,4/3/2023
35,2,Stock Controlling Supervisor,"Phân tích đối thủ cạnh tranh, khảo sát từ khóa, lập kế hoạch SEO cho dự án website.Đề xuất kế hoạch và thực hiện tối ưu onpage, audit site, offpage …. để tăng thứ hạng website.Theo dõi sự phát triển của website, hiệu quả chiến dịch SEO, đề xuất phương án cải thiện nếu cần.Set up hệ thống vệ tinh và quản trị website vệ tinh.Phối hợp triển khai các chiến dịch, kế hoạch quảng cáo trên hệ thống nền tảng Online.Lập báo cáo thường kỳ theo tháng về kết quả SEO. ","Bachelor Degree – Business Administration, Economics, Logistic2 years working experience in the similar position (especially Retail field)Strong communication, hardworking and carefulStrong analytical ability and good in data/ figures.Good at MS OfficeEnglish communication ","- Mon - Fri, off Sat & Sunday- Meal allowance: 50,000 VND/working day- SHUI on full salary package- 13rd salary ++- Add-on health insurance PTI- Dynamic working environment- Open for career Path ",3,8,1,Toàn thời gian,2,2,3/25/2023,11/4/2024,4/3/2023
36,2,Đào Tạo Quản Lý Canteen Tập Sự (8-10 Triệu),"- Chịu trách nhiệm phát triển các Khách hàng mới là đại lý, cửa hàng tạp hóa, siêu thị tiện lợi- Thực hiện việc đi thăm, khảo sát các đại lý hàng ngày tại khu vực phụ trách bằng xe máy.- Đảm bảo đầy đủ lượt khảo sát theo chỉ tiêu do Quản lý phát triển thị trường giao cho.- Truyền tải và đóng góp các ý kiến phản hồi để ngày càng hoàn thiện sản phẩm cho Khách hàng. ","- Tốt nghiệp Đại học, Cao đẳng chuyên ngành Công nghệ thực phẩm, Quản trị kinh doanh, Quản lý công nghiệp.- Độ tuổi từ 22 – 25- Nhận đào tạo không cần kinh nghiệm- Thành thạo vi tính văn phòng, khả năng tổng hợp, thống kê, và báo cáo số liệu.- Làm việc tại các cơ sở canteen/ nhà máy ","Phúc lợi, chế độ đầy đủ (BHXH, thưởng, trợ cấp, phép năm,...)Miễn phí cơm trưaCơ hội tham gia các khóa đào tạo quản lýLương tháng 13/ Review lương hằng năm ",3,7,10,Toàn thời gian,0,1,3/25/2024,4/18/2024,4/3/2023
37,19,Nhân Viên Kinh Doanh,Tham gia giảng dạy các lớp IELTS từ 0-6.5Tham gia xây dựng lộ trình học( Chưa có nhiều kinh nghiệm sẽ được training cầm tay chỉ việc) ,"- Tuổi từ 22 - 35- Tốt nghiệp trung cấp trở lên, có thể đi công tác ngắn ngày.- Tối thiểu 02 năm kinh nghiệm làm sales, ưu tiên sales B2B hoặc sales các mảng sữa, dược, thực phẩm.- Kĩ năng giao tiếp tốt, tự tin, có khả năng thuyết phục, chốt sale- Trung thực, nhanh nhẹn, có tinh thần trách nhiệm cao trong công việc. ","- Lương cơ bản: 10 tr + % Hoa hồng hấp dẫn- Được cung cấp điện thoại, laptop để làm việc- Được làm trong môi trường chuyên nghiệp, năng động- Chế độ nghỉ phép, nghỉ lễ, du lịch hàng năm, bảo hiểm theo quy định.- Các quyền lợi khác theo quy định củɑ nhà nước và Công ty ",10,20,10,Toàn thời gian,2,2,3/30/2023,7/2/2024,4/3/2023
